{
  "id": "VE-2024-TSJ-ELECTION-VALIDATION",
  "title": "Sentencia 031 de la Sala Electoral sobre la elección presidencial de 2024",
  "event_date": "2024-08-22",
  "status": "reviewed",
  "institutions": [
    "VE-I-TSJ-SALA-ELECTORAL",
    "VE-I-CNE"
  ],
  "documents": [
    {
      "id": "VE-2024-CNE-COMUNICADO-2024-08-26",
      "title": "Comunicado oficial del Consejo Nacional Electoral",
      "publisher": "Consejo Nacional Electoral",
      "source_url": "https://ikona.telesurtv.net/content/uploads/2024/08/COMUNICADO-PODER-ELECTORAL-2.pdf",
      "retrieved_at": "2026-08-08T00:00:00Z",
      "sha256": "dea3b8c4b9a9b9e18a16f1dd9b00adc7492eb920b34eb0230885f285efd8c91a",
      "archived_urls": [],
      "language": "es"
    },
    {
      "id": "VE-2024-TSJ-ORDER-2024-08-10",
      "title": "Orden de continuación del peritaje electoral",
      "publisher": "Tribunal Supremo de Justicia, Sala Electoral",
      "source_url": "https://www.elclarin.cl/wp-content/uploads/2024/08/1_5026536136453915901-1.pdf",
      "retrieved_at": "2026-08-08T00:00:00Z",
      "sha256": "aa66ed7b796b02bfbf2a0efc6922b578fa28bc42a16e81ee2abd61f8bf0e4076",
      "archived_urls": [],
      "language": "es"
    },
    {
      "id": "EU-2025-REG-2025-44",
      "title": "Reglamento de Ejecución (UE) 2025/44",
      "publisher": "Consejo de la Unión Europea",
      "source_url": "https://www.boe.es/doue/2025/044/L00001-00009.pdf",
      "retrieved_at": "2026-08-08T00:00:00Z",
      "sha256": "6b8b3aadbda69a0deaa01e60a2959b037356d42ba7bf6219b9c246daf2d5ee91",
      "archived_urls": ["http://data.europa.eu/eli/reg_impl/2025/44/oj"],
      "language": "es"
    }
  ],
  "claims": [
    {
      "id": "VE-2024-TSJ-CLAIM-001",
      "kind": "documented_fact",
      "text": "El Consejo Nacional Electoral declaró haber recibido notificación de la sentencia número 031, de 22 de agosto de 2024, dictada por la Sala Electoral en relación con la elección presidencial del 28 de julio de 2024.",
      "persons": [],
      "citations": [
        {"document_id": "VE-2024-CNE-COMUNICADO-2024-08-26", "locator": "página 1, párrafo 1"}
      ]
    },
    {
      "id": "VE-2024-TSJ-CLAIM-002",
      "kind": "documented_fact",
      "text": "Según el comunicado del CNE, la Sala Electoral declaró con lugar el recurso, certificó el material electoral peritado y convalidó los resultados emitidos por el CNE.",
      "persons": [],
      "citations": [
        {"document_id": "VE-2024-CNE-COMUNICADO-2024-08-26", "locator": "página 1, párrafo 2"}
      ]
    },
    {
      "id": "VE-2024-TSJ-CLAIM-003",
      "kind": "documented_fact",
      "text": "El comunicado del CNE enumera a Elvis Amoroso, Carlos Quintero, Rosalba Gil, Acme Nogal, Conrado Pérez, Leonel Párica, Imad Saab Saab, Aura Hernández, Gustavo Vizcaíno, Antonieta de Stefano, Fabio Zavarse, Francisco Garcés y Antonio Meneses con sus respectivos cargos institucionales.",
      "persons": [
        "VE-P-ELVIS-AMOROSO", "VE-P-CARLOS-QUINTERO", "VE-P-ROSALBA-GIL",
        "VE-P-ACME-NOGAL", "VE-P-CONRADO-PEREZ", "VE-P-LEONEL-PARICA",
        "VE-P-IMAD-SAAB-SAAB", "VE-P-AURA-HERNANDEZ", "VE-P-GUSTAVO-VIZCAINO",
        "VE-P-ANTONIETA-DE-STEFANO", "VE-P-FABIO-ZAVARSE", "VE-P-FRANCISCO-GARCES",
        "VE-P-ANTONIO-MENESES"
      ],
      "citations": [
        {"document_id": "VE-2024-CNE-COMUNICADO-2024-08-26", "locator": "página 2"}
      ]
    },
    {
      "id": "VE-2024-TSJ-CLAIM-004",
      "kind": "attributed_assessment",
      "text": "El Consejo de la Unión Europea atribuyó a Caryslia Rodríguez la declaración de la victoria proclamada, a Fanny Márquez participación en la certificación y a Inocencio Figueroa apoyo a esa certificación; también indicó que el TSJ no divulgó los datos detallados de votación en que se basó.",
      "persons": ["VE-P-CARYSLIA-RODRIGUEZ", "VE-P-FANNY-MARQUEZ", "VE-P-INOCENCIO-FIGUEROA"],
      "citations": [
        {"document_id": "EU-2025-REG-2025-44", "locator": "anexo, entradas 56-58, páginas 2-3"}
      ]
    },
    {
      "id": "VE-2024-TSJ-CLAIM-005",
      "kind": "project_analysis",
      "text": "El archivo todavía no ha localizado una copia íntegra verificable de la sentencia final 031. El comunicado del CNE y el reglamento de la UE prueban su existencia y describen sus efectos, pero no sustituyen el texto completo de la sentencia.",
      "persons": [],
      "citations": [
        {"document_id": "VE-2024-CNE-COMUNICADO-2024-08-26", "locator": "páginas 1-2"},
        {"document_id": "EU-2025-REG-2025-44", "locator": "anexo, entradas 56-58, páginas 2-3"}
      ]
    }
  ]
}
